ID	Text	Pronoun	Pronoun-offset	A	A-offset	A-coref	B	B-offset	B-coref	URL
validation-1	He admitted making four trips to China and playing golf there. He also admitted that ZTE officials, whom he says are his golf buddies, hosted and paid for the trips. Jose de Venecia III, son of House Speaker Jose de Venecia Jr, alleged that Abalos offered him US$10 million to withdraw his proposal on the NBN project.	him	256	Jose de Venecia Jr	208	FALSE	Abalos	241	FALSE	http://en.wikipedia.org/wiki/Commission_on_Elections_(Philippines)
validation-2	Kathleen Nott was born in Camberwell, London. Her father, Philip, was a lithographic printer, and her mother, Ellen, ran a boarding house in Brixton; Kathleen was their third daughter. She was educated at Mary Datchelor Girls' School (now closed), London, before attending King's College, London.	She	185	Ellen	110	FALSE	Kathleen	150	TRUE	http://en.wikipedia.org/wiki/Kathleen_Nott
validation-3	When she returns to her hotel room, a Liberian man (Tony Todd) forces her to smuggle $20 million worth of conflict diamonds to New York, or else fellow fight attendant and friend Angela will die. She is caught before she can board the flight, and the team now have nine hours until the plane lands, and save Angela. After the confiscated diamonds are stolen by the brother of Kaleo (Jason Scott Lee), whom Danny put away for murdering his partner last year, Five-0 and Chief Fryer team up and enlist the help of August March (Ed Asner), who served a 30-year sentence for smuggling diamonds.	his	435	Jason Scott Lee	383	FALSE	Danny	406	TRUE	http://en.wikipedia.org/wiki/Hawaii_Five-0_(2010_TV_series,_season_2)
validation-4	On 19 March 2007, during a campaign appearance for the New South Wales State Election, the then opposition leader Peter Debnam was confronted by Reucassel wearing nothing but Speedos and a baseball cap, making fun of Debnam's campaign appearances in the swimwear. When TV cameras remained focused on Reucassel rather than Mr Debnam, he said, ``Sorry, I'm not Peter Debnam, he's over there.	he	333	Reucassel	300	TRUE	Debnam	325	FALSE	http://en.wikipedia.org/wiki/Craig_Reucassel
validation-5	By this time, Karen Blixen had separated from her husband, and after their divorce in 1925, Finch Hatton moved into her house and began leading safaris for wealthy sportsmen. Among his clients were Marshall Field Jr and Edward, Prince of Wales. According to the author Mary Lovell, in 1930 Finch Hatton began a love affair with Beryl Markham, who was working as a race-horse trainer in Nairobi and the surrounding area. Later, she would become known as a pioneer flyer herself (Markham attributed her interest in flying to her association with Tom Campbell Black).	she	427	Finch Hatton	290	FALSE	Beryl Markham	328	TRUE	http://en.wikipedia.org/wiki/Denys_Finch_Hatton